{
  "alpha": true,
  "counts": {
    "covered": 2,
    "deprecated": 0,
    "floor": 0,
    "removed": 0
  },
  "fallback": null,
  "findings": [
    {
      "covered": true,
      "file": "php_window.module",
      "kind": "deprecated",
      "line": 12,
      "message": "The integer cast is deprecated since PHP 8.5; Use (int) instead",
      "rule": "p85-cast-names",
      "source": "PHPCompatibility.TypeCasts.RemovedTypeCasts.integerDeprecated",
      "type": "WARNING"
    },
    {
      "covered": true,
      "file": "src/Connection.php",
      "kind": "deprecated",
      "line": 20,
      "message": "Implicitly marking a parameter as nullable is deprecated since PHP 8.4. Update the type to be explicitly nullable instead. Found implicitly nullable parameter: $prefix.",
      "rule": "p84-implicit-nullable",
      "source": "PHPCompatibility.FunctionDeclarations.RemovedImplicitlyNullableParam.Deprecated",
      "type": "WARNING"
    }
  ],
  "reason": null,
  "standards": [
    "PHPCompatibility",
    "PHPCompatibilitySymfonyPolyfillPHP84",
    "PHPCompatibilitySymfonyPolyfillPHP85"
  ],
  "status": "ok",
  "test_version": "8.3-8.5",
  "tool": "phpcompat",
  "versions": {
    "dealerdirect/phpcodesniffer-composer-installer": "v1.2.1",
    "phpcompatibility/php-compatibility": "10.0.0-alpha2",
    "phpcompatibility/phpcompatibility-paragonie": "2.0.0-alpha2",
    "phpcompatibility/phpcompatibility-passwordcompat": "2.0.0-alpha1",
    "phpcompatibility/phpcompatibility-symfony": "2.0.0-alpha3",
    "phpcsstandards/phpcsutils": "1.2.3",
    "squizlabs/php_codesniffer": "4.0.4"
  }
}
